{
  "schemaVersion": 2,
  "name": "MALIEV Portable Neutral",
  "theme": {
    "schemaVersion": 1,
    "name": "MALIEV Portable Neutral",
    "light": {
      "background": "oklch(1 0 0)",
      "foreground": "oklch(0.145 0 0)",
      "card": "oklch(1 0 0)",
      "cardForeground": "oklch(0.145 0 0)",
      "popover": "oklch(1 0 0)",
      "popoverForeground": "oklch(0.145 0 0)",
      "primary": "oklch(0.205 0 0)",
      "primaryForeground": "oklch(0.985 0 0)",
      "secondary": "oklch(0.97 0 0)",
      "secondaryForeground": "oklch(0.205 0 0)",
      "muted": "oklch(0.97 0 0)",
      "mutedForeground": "oklch(0.556 0 0)",
      "accent": "oklch(0.97 0 0)",
      "accentForeground": "oklch(0.205 0 0)",
      "destructive": "oklch(0.577 0.245 27.325)",
      "destructiveForeground": "oklch(0.985 0 0)",
      "border": "oklch(0.922 0 0)",
      "input": "oklch(0.922 0 0)",
      "ring": "oklch(0.708 0 0)",
      "chart1": "oklch(0.646 0.222 41.116)",
      "chart2": "oklch(0.6 0.118 184.704)",
      "chart3": "oklch(0.398 0.07 227.392)",
      "chart4": "oklch(0.828 0.189 84.429)",
      "chart5": "oklch(0.769 0.188 70.08)",
      "sidebar": "oklch(0.985 0 0)",
      "sidebarForeground": "oklch(0.145 0 0)",
      "sidebarPrimary": "oklch(0.205 0 0)",
      "sidebarPrimaryForeground": "oklch(0.985 0 0)",
      "sidebarAccent": "oklch(0.97 0 0)",
      "sidebarAccentForeground": "oklch(0.205 0 0)",
      "sidebarBorder": "oklch(0.922 0 0)",
      "sidebarRing": "oklch(0.708 0 0)",
      "shadowExtraSmall": "0 1px 2px rgb(0 0 0 / 0.05)",
      "shadowSmall": "0 1px 3px rgb(0 0 0 / 0.1), 0 1px 2px -1px rgb(0 0 0 / 0.1)",
      "shadowMedium": "0 4px 6px -1px rgb(0 0 0 / 0.1), 0 2px 4px -2px rgb(0 0 0 / 0.1)"
    },
    "dark": {
      "background": "oklch(0.145 0 0)",
      "foreground": "oklch(0.985 0 0)",
      "card": "oklch(0.205 0 0)",
      "cardForeground": "oklch(0.985 0 0)",
      "popover": "oklch(0.205 0 0)",
      "popoverForeground": "oklch(0.985 0 0)",
      "primary": "oklch(0.922 0 0)",
      "primaryForeground": "oklch(0.205 0 0)",
      "secondary": "oklch(0.269 0 0)",
      "secondaryForeground": "oklch(0.985 0 0)",
      "muted": "oklch(0.269 0 0)",
      "mutedForeground": "oklch(0.708 0 0)",
      "accent": "oklch(0.269 0 0)",
      "accentForeground": "oklch(0.985 0 0)",
      "destructive": "oklch(0.704 0.191 22.216)",
      "destructiveForeground": "oklch(0.985 0 0)",
      "border": "oklch(1 0 0 / 10%)",
      "input": "oklch(1 0 0 / 15%)",
      "ring": "oklch(0.556 0 0)",
      "chart1": "oklch(0.488 0.243 264.376)",
      "chart2": "oklch(0.696 0.17 162.48)",
      "chart3": "oklch(0.769 0.188 70.08)",
      "chart4": "oklch(0.627 0.265 303.9)",
      "chart5": "oklch(0.645 0.246 16.439)",
      "sidebar": "oklch(0.205 0 0)",
      "sidebarForeground": "oklch(0.985 0 0)",
      "sidebarPrimary": "oklch(0.488 0.243 264.376)",
      "sidebarPrimaryForeground": "oklch(0.985 0 0)",
      "sidebarAccent": "oklch(0.269 0 0)",
      "sidebarAccentForeground": "oklch(0.985 0 0)",
      "sidebarBorder": "oklch(1 0 0 / 10%)",
      "sidebarRing": "oklch(0.556 0 0)",
      "shadowExtraSmall": "0 1px 2px rgb(0 0 0 / 0.24)",
      "shadowSmall": "0 1px 2px rgb(0 0 0 / 0.28), 0 0 0 1px rgb(255 255 255 / 0.06)",
      "shadowMedium": "0 8px 24px rgb(0 0 0 / 0.36), 0 0 0 1px rgb(255 255 255 / 0.08)"
    },
    "metrics": {
      "fontFamily": "'Geist', 'Noto Sans Thai', ui-sans-serif, system-ui, sans-serif",
      "monospaceFontFamily": "'JetBrains Mono', ui-monospace, SFMono-Regular, Menlo, Monaco, Consolas, monospace",
      "radiusRem": 0.625,
      "radiusSmallScale": 0.6,
      "radiusMediumScale": 0.8,
      "radiusLargeScale": 1,
      "radiusExtraLargeScale": 1.4,
      "radius2ExtraLargeScale": 1.8,
      "radius3ExtraLargeScale": 2.2,
      "radius4ExtraLargeScale": 2.6,
      "controlHeightRem": 2.25,
      "controlHeightSmallRem": 2,
      "controlHeightLargeRem": 2.5,
      "spacingScaleMultiplier": 1,
      "focusRingWidthPx": 3,
      "focusRingOffsetPx": 0,
      "motionDurationMilliseconds": 150,
      "motionEasing": "ease-out",
      "reducedMotionBehavior": "respectSystemPreference"
    }
  },
  "application": {
    "preset": "base-vega-neutral",
    "style": "vega",
    "baseColor": "neutral",
    "iconLibrary": "lucide",
    "menuAccent": "default",
    "menuColor": "default",
    "defaultDarkMode": false,
    "defaultDirection": "leftToRight",
    "defaultLocale": "en",
    "reducedMotionBehavior": "respectSystemPreference"
  },
  "palette": {
    "algorithmVersion": 1,
    "seed": 42,
    "baseColor": "neutral",
    "lockedTokens": [
      "light.primary"
    ]
  },
  "typography": {
    "body": {
      "family": "'Geist', 'Noto Sans Thai', ui-sans-serif, system-ui, sans-serif",
      "fallback": "sans-serif",
      "googleFontsId": null
    },
    "thaiFallback": {
      "family": "'Noto Sans Thai'",
      "fallback": "sans-serif",
      "googleFontsId": null
    },
    "code": {
      "family": "'JetBrains Mono', ui-monospace, SFMono-Regular, Menlo, Monaco, Consolas, monospace",
      "fallback": "monospace",
      "googleFontsId": null
    },
    "roles": {
      "body": {
        "weight": 400,
        "scale": 1,
        "lineHeight": 1.5,
        "letterSpacingEm": 0
      },
      "heading1": {
        "weight": 700,
        "scale": 2.25,
        "lineHeight": 1.1,
        "letterSpacingEm": -0.03
      },
      "heading2": {
        "weight": 700,
        "scale": 1.875,
        "lineHeight": 1.15,
        "letterSpacingEm": -0.025
      },
      "heading3": {
        "weight": 600,
        "scale": 1.5,
        "lineHeight": 1.2,
        "letterSpacingEm": -0.02
      },
      "heading4To6": {
        "weight": 600,
        "scale": 1.125,
        "lineHeight": 1.3,
        "letterSpacingEm": -0.01
      },
      "label": {
        "weight": 500,
        "scale": 0.875,
        "lineHeight": 1.4,
        "letterSpacingEm": 0
      },
      "button": {
        "weight": 500,
        "scale": 0.875,
        "lineHeight": 1,
        "letterSpacingEm": 0
      },
      "caption": {
        "weight": 400,
        "scale": 0.75,
        "lineHeight": 1.4,
        "letterSpacingEm": 0
      },
      "code": {
        "weight": 400,
        "scale": 0.875,
        "lineHeight": 1.5,
        "letterSpacingEm": 0
      }
    }
  }
}
